{
  "export_id": "215e6da1c963",
  "hypotheses": {
    "by_type": {
      "cross_sectional": 17,
      "overlay": 0,
      "unknown": 0
    },
    "count": 17,
    "semantic_hashes": [
      "1ad1e254bf61",
      "2cbc5e1a3758",
      "342f77a90c05",
      "4940a5537824",
      "498d5ac6cbae",
      "4bfd4a485462",
      "4dd9f45a3ff6",
      "513c61a9f961",
      "7abfdd909493",
      "94283b6f464f",
      "aacbbdf5e9f3",
      "acabea18b2aa",
      "b3004f0a330e",
      "b8e86e560e65",
      "d8f3afdf2d1d",
      "e07beb59a90b",
      "f01d0d6885f2"
    ]
  },
  "kind": "crucible_closed_search",
  "power": {
    "decisive_mde_multiple": 1.0,
    "economic_floor": 0.1,
    "economic_floor_gates_hash": "519158fa1450",
    "economic_floor_source": "generation.min_combination_uplift",
    "mde_at_test_max": null,
    "mde_at_test_min": null,
    "mde_source": "none",
    "mde_substrate": 1.68267,
    "mde_unmeasured_ticks": 1
  },
  "provenance": {
    "cohort_gates_hashes": [],
    "contracts": [
      "shipped"
    ],
    "corrected_gates_hashes": [],
    "crucible_versions": [
      "crucible-v11.0",
      "crucible-v2.6"
    ],
    "data_snapshot_hashes": [
      "65e7df83d606",
      "8c9aad14769f",
      "99271d049fd9"
    ],
    "first_date": "2026-07-02",
    "gates_hashes": [
      "519158fa1450"
    ],
    "last_date": "2026-08-01",
    "manifest_hashes": [
      "57ab2c1b6f21"
    ],
    "proposers": [
      "library-seed-v1"
    ],
    "runs": 1,
    "search_memory_gates_hashes": [],
    "source": "trial_ledger"
  },
  "rejections": {
    "decisive": 0,
    "unclassified": null,
    "underpowered": 0
  },
  "schema_version": 1,
  "substrate": {
    "data_end": "2026-07-02",
    "data_sources": [
      "Yahoo Finance daily bars"
    ],
    "data_start": "2008-01-01",
    "id": "cross_asset",
    "search_space": "library seed formulas plus genetic offspring; 21-day hold",
    "universe": "18 US-listed ETFs across equity, rates, commodity and FX"
  },
  "ticks": {
    "cohort_only": 0,
    "errors": 0,
    "idle": 3,
    "mined": 1,
    "no_score": 0,
    "screened_only": 0,
    "screened_unknown": 1,
    "tested": 0,
    "total": 5,
    "underpowered_skips": 1
  },
  "trials": {
    "holdout_count_complete": false,
    "holdout_tested": null,
    "preregistered": 8,
    "promising": 0,
    "recorded": 18,
    "scored": 17
  },
  "verdict": "OPEN_UNDERPOWERED",
  "verdict_reasons": [
    "holdout_count_not_recorded",
    "mde_above_floor"
  ]
}
