{
  "export_id": "b3695ef7662b",
  "hypotheses": {
    "by_type": {
      "cross_sectional": 18,
      "overlay": 34,
      "unknown": 0
    },
    "count": 52,
    "semantic_hashes": [
      "01d9d0131399",
      "047417073b32",
      "0984c6eb616e",
      "1d22da652e10",
      "1e76560c6610",
      "2730f25174da",
      "2cf911f9b7f4",
      "342f77a90c05",
      "36e34e5fc640",
      "39806662a938",
      "39ee5f57d671",
      "3b20e32a365c",
      "3ce80de97f9e",
      "42d417af6d17",
      "498d5ac6cbae",
      "4bfd4a485462",
      "502b39e2e1bb",
      "513c61a9f961",
      "53b12b38e251",
      "56664125b874",
      "576a0164037d",
      "5b68aadbe74a",
      "6b8edf335bbe",
      "724f1cd6c758",
      "746f753858c1",
      "7bbe4fc0b1c1",
      "81ca4c7e4de6",
      "851273d798f8",
      "898f24349686",
      "8bc7255ad0f8",
      "921a5e4b69cf",
      "9283ee0310e1",
      "94283b6f464f",
      "9a5248ff29e1",
      "9d13697f82d4",
      "9d46f1d9421e",
      "a6a7b6cb6a4b",
      "b3004f0a330e",
      "b4f0d20c21db",
      "b76838e9ce03",
      "b7de554d55a2",
      "ba01b009f1a3",
      "bcbce7d34c0d",
      "bd4d5389e0d2",
      "d565dcb7dbb9",
      "d5688a2ae3ec",
      "d5b9a4e9c506",
      "d76cc86dcd3e",
      "e07beb59a90b",
      "e1e7d44b89b3",
      "ea26d81631e9",
      "fa653096ca52"
    ]
  },
  "kind": "crucible_closed_search",
  "power": {
    "decisive_mde_multiple": 1.0,
    "economic_floor": 0.1,
    "economic_floor_gates_hash": "d1523707b860",
    "economic_floor_source": "guards.uplift_min",
    "mde_at_test_max": 1.68267,
    "mde_at_test_min": 1.68267,
    "mde_source": "tick_log",
    "mde_substrate": 1.68267,
    "mde_unmeasured_ticks": 0
  },
  "provenance": {
    "cohort_gates_hashes": [],
    "contracts": [
      "corrected"
    ],
    "corrected_gates_hashes": [
      "7fc2a73be779"
    ],
    "crucible_versions": [
      "crucible-v11.0"
    ],
    "data_snapshot_hashes": [
      "8c9aad14769f"
    ],
    "first_date": "2026-08-04",
    "gates_hashes": [
      "8ec4820b3983"
    ],
    "last_date": "2026-08-04",
    "manifest_hashes": [
      "bdf4722a2f03"
    ],
    "proposers": [
      "library-seed-v1"
    ],
    "runs": 1,
    "search_memory_gates_hashes": [
      "26a0f6433347"
    ],
    "source": "trial_ledger"
  },
  "rejections": {
    "decisive": 0,
    "unclassified": null,
    "underpowered": 0
  },
  "schema_version": 1,
  "substrate": {
    "data_end": "2026-08-04",
    "data_sources": [
      "Yahoo Finance daily bars"
    ],
    "data_start": "2008-01-01",
    "id": "cross_asset",
    "search_space": "library seed formulas plus genetic offspring; 1-day hold",
    "universe": "18 US-listed ETFs across equity, rates, commodity and FX"
  },
  "ticks": {
    "cohort_only": 0,
    "errors": 0,
    "idle": 0,
    "mined": 1,
    "no_score": 0,
    "screened_only": 0,
    "screened_unknown": 1,
    "tested": 0,
    "total": 1,
    "underpowered_skips": 0
  },
  "trials": {
    "holdout_count_complete": false,
    "holdout_tested": null,
    "preregistered": 32,
    "promising": 0,
    "recorded": 52,
    "scored": 52
  },
  "verdict": "OPEN_UNDERPOWERED",
  "verdict_reasons": [
    "holdout_count_not_recorded",
    "mde_above_floor"
  ]
}
