{
  "export_id": "f58005efc4f5",
  "hypotheses": {
    "by_type": {
      "cross_sectional": 73,
      "overlay": 77,
      "unknown": 0
    },
    "count": 150,
    "semantic_hashes": [
      "01d9d0131399",
      "026b5ac62599",
      "047417073b32",
      "04a543c26391",
      "04f2be71d6bf",
      "05353b5e9c58",
      "080216d301e1",
      "08b1b2ff7e2f",
      "0984c6eb616e",
      "09dafc384605",
      "146463d2d260",
      "150a31bdd61a",
      "17181762da38",
      "1b7d25024f4f",
      "1d22da652e10",
      "1d418493d46e",
      "1d872e07c8de",
      "1e6bbdc27f4b",
      "20dccf2deac6",
      "219cee5a97fc",
      "21dee7aa49ad",
      "2261666631a7",
      "22af98b4a2b0",
      "239cb5977009",
      "2434f430b1b4",
      "248fdc4859eb",
      "264ac96a3551",
      "2730f25174da",
      "2ccb96cbe51b",
      "2d7a7f501a4e",
      "2f1c6904f7e6",
      "32cb2e759e38",
      "35d87c1a1436",
      "36baed3d46b5",
      "36e34e5fc640",
      "380ba175a673",
      "3946a207c7c9",
      "3aa09a2cb107",
      "3b20e32a365c",
      "3ba9c527b2f8",
      "401eb83f81e2",
      "40f96dff45d5",
      "419341d78e8a",
      "42287a82d49a",
      "44e470fbee55",
      "45e6c5fe4bf2",
      "4862eb917c92",
      "48967bd74964",
      "48f03678379b",
      "4aca71d4932b",
      "4be41ac2094c",
      "4c37cc7e7eb4",
      "4d024ee2d399",
      "502b39e2e1bb",
      "50c1fd4fd35d",
      "53b12b38e251",
      "55a0cc8dac88",
      "576a0164037d",
      "58555b9f59f7",
      "59990059e203",
      "5c56e492b3e4",
      "5ec97b4863cd",
      "5ee20d1f9aed",
      "5f0e8f128950",
      "5f7fb6f372a3",
      "60af05fc8771",
      "60f5c12769fd",
      "61cc243b4202",
      "658fe10ca49c",
      "6b42fd63349f",
      "6b8edf335bbe",
      "6bc1f8ad4493",
      "6d103e128e1c",
      "6ffd3fb21383",
      "721cbbefcf32",
      "7410997b91f2",
      "7512f81a8992",
      "795d18e403e2",
      "7d9416175f2f",
      "81041f3fabd9",
      "81ca4c7e4de6",
      "8391192daf19",
      "842d4fdafc80",
      "851273d798f8",
      "852b1306386d",
      "85aa1c48bb56",
      "85ae8d8d86b8",
      "875b17dddb44",
      "8abfd09a9edb",
      "8bc7255ad0f8",
      "8eb0b95979b4",
      "91d8e193e55f",
      "921a5e4b69cf",
      "9283ee0310e1",
      "93e350fc48a2",
      "95d843588c59",
      "97110c90c664",
      "98009c041d34",
      "995068844e94",
      "9a7d989bf8d0",
      "9abb132945b2",
      "9bb79c6fe31c",
      "9d13697f82d4",
      "9ddd242aa721",
      "a1e757351167",
      "a53c6bba4918",
      "a6a7b6cb6a4b",
      "a6d0e72b1b7c",
      "abeb14526fe8",
      "adfb890abb51",
      "b02cdd8b73a0",
      "b25482e46be7",
      "b279cb3d6771",
      "b4ce70775965",
      "b4f0d20c21db",
      "b617863352dc",
      "b9370e9d8332",
      "b96100e335a3",
      "b9d5a5b6afbb",
      "bcbce7d34c0d",
      "bd7e8ff9677f",
      "be3e684a28c4",
      "bff804c0e11e",
      "c0507cfa72be",
      "c19cf34ae14e",
      "c4bc7db59a7b",
      "ccb775337ec3",
      "d20a4c362c28",
      "d5688a2ae3ec",
      "d5b59aa69889",
      "d5b9a4e9c506",
      "d6f003cf7c76",
      "d76cc86dcd3e",
      "dcf9a1f8b37f",
      "e1e7d44b89b3",
      "e3f3a31c88a6",
      "e6fcb5b3b004",
      "e9ad6bc9f731",
      "f02e44f22722",
      "f03484c4f9b6",
      "f13a938f8568",
      "f28a2220ceb6",
      "f483af160c9d",
      "f4d7eb513d4c",
      "f686f4d081ae",
      "f6cc8397146c",
      "fa653096ca52",
      "fd5b25478136",
      "fe4955be5b77",
      "ff44805974cf"
    ]
  },
  "kind": "crucible_closed_search",
  "power": {
    "decisive_mde_multiple": 1.0,
    "economic_floor": 0.1,
    "economic_floor_gates_hash": "d1523707b860",
    "economic_floor_source": "guards.uplift_min",
    "mde_at_test_max": 1.312053,
    "mde_at_test_min": 1.312053,
    "mde_source": "tick_log",
    "mde_substrate": 1.312053,
    "mde_unmeasured_ticks": 0
  },
  "provenance": {
    "cohort_gates_hashes": [
      "70d244b44640",
      "adb83df7d588"
    ],
    "contracts": [
      "corrected"
    ],
    "corrected_gates_hashes": [
      "36a9d93984d4",
      "d1523707b860",
      "f00c3b5fa6d6"
    ],
    "crucible_versions": [
      "crucible-v11.0",
      "crucible-v12.0",
      "crucible-v12.1"
    ],
    "data_snapshot_hashes": [
      "65e7df83d606",
      "6c5b5e049eb0",
      "6d80e9e57c8f",
      "7abdc48daa0c"
    ],
    "first_date": "2026-08-09",
    "gates_hashes": [
      "b5155fe6da9c",
      "f949b3b565fe"
    ],
    "last_date": "2026-08-11",
    "manifest_hashes": [
      "1e6d8b8d2d6f",
      "6a99ab8dc110",
      "b7ab5b10bf00",
      "e3095c568d2d"
    ],
    "proposers": [
      "library-seed-v1"
    ],
    "runs": 4,
    "search_memory_gates_hashes": [
      "26a0f6433347"
    ],
    "source": "trial_ledger"
  },
  "rejections": {
    "decisive": 0,
    "unclassified": 42,
    "underpowered": 0
  },
  "schema_version": 1,
  "substrate": {
    "data_end": "2026-08-10",
    "data_sources": [
      "S&P 500 membership history (fja05680)",
      "Yahoo Finance daily bars"
    ],
    "data_start": "2007-01-01",
    "id": "us_equity",
    "search_space": "library seed formulas plus genetic offspring (the library includes the WorldQuant-101 bank); 2-day hold",
    "universe": "S&P 500 members (point-in-time), top 300 by trailing dollar volume each day"
  },
  "ticks": {
    "cohort_only": 1,
    "errors": 0,
    "idle": 4,
    "mined": 4,
    "no_score": 0,
    "screened_only": 0,
    "screened_unknown": 1,
    "tested": 3,
    "total": 11,
    "underpowered_skips": 2
  },
  "trials": {
    "holdout_count_complete": false,
    "holdout_tested": 42,
    "preregistered": 140,
    "promising": 0,
    "recorded": 190,
    "scored": 151
  },
  "verdict": "OPEN_UNDERPOWERED",
  "verdict_reasons": [
    "holdout_count_not_recorded",
    "unclassified_rejections",
    "mde_above_floor"
  ]
}
