{
  "export_id": "4d1f7d29f742",
  "hypotheses": {
    "by_type": {
      "cross_sectional": 18,
      "overlay": 0,
      "unknown": 0
    },
    "count": 18,
    "semantic_hashes": [
      "342f77a90c05",
      "498d5ac6cbae",
      "4bfd4a485462",
      "510db5ed171b",
      "513c61a9f961",
      "5b68aadbe74a",
      "5f75882306e6",
      "74b3fa2b4246",
      "8322ad292164",
      "843b1f97b9e6",
      "94283b6f464f",
      "b3004f0a330e",
      "b31fc9fa93a9",
      "d173b3a6d37c",
      "d59c9a8ae416",
      "e07beb59a90b",
      "e6f50433d8a6",
      "eec9e49019f0"
    ]
  },
  "kind": "crucible_closed_search",
  "power": {
    "decisive_mde_multiple": 1.0,
    "economic_floor": 0.1,
    "economic_floor_gates_hash": "d1523707b860",
    "economic_floor_source": "guards.uplift_min",
    "mde_at_test_max": 1.905556,
    "mde_at_test_min": 1.905556,
    "mde_source": "tick_log",
    "mde_substrate": 1.905556,
    "mde_unmeasured_ticks": 0
  },
  "provenance": {
    "cohort_gates_hashes": [],
    "contracts": [
      "corrected"
    ],
    "corrected_gates_hashes": [
      "7fc2a73be779"
    ],
    "crucible_versions": [
      "crucible-v11.0"
    ],
    "data_snapshot_hashes": [
      "661271fa2a0b"
    ],
    "first_date": "2026-08-02",
    "gates_hashes": [
      "c84218a4c434"
    ],
    "last_date": "2026-08-02",
    "manifest_hashes": [
      "8ba04a1be8a7"
    ],
    "proposers": [
      "library-seed-v1"
    ],
    "runs": 1,
    "search_memory_gates_hashes": [
      "26a0f6433347"
    ],
    "source": "trial_ledger"
  },
  "rejections": {
    "decisive": 0,
    "unclassified": null,
    "underpowered": 0
  },
  "schema_version": 1,
  "substrate": {
    "data_end": "2026-07-31",
    "data_sources": [
      "Dukascopy hourly bars"
    ],
    "data_start": "2013-01-01",
    "id": "intraday",
    "search_space": "library seed formulas plus genetic offspring; 21-bar hold",
    "universe": "12 hourly instruments (FX, metals, energy)"
  },
  "ticks": {
    "cohort_only": 0,
    "errors": 0,
    "idle": 0,
    "mined": 1,
    "no_score": 0,
    "screened_only": 0,
    "screened_unknown": 1,
    "tested": 0,
    "total": 1,
    "underpowered_skips": 0
  },
  "trials": {
    "holdout_count_complete": false,
    "holdout_tested": null,
    "preregistered": 8,
    "promising": 0,
    "recorded": 18,
    "scored": 18
  },
  "verdict": "OPEN_UNDERPOWERED",
  "verdict_reasons": [
    "holdout_count_not_recorded",
    "mde_above_floor"
  ]
}
