{
  "export_id": "6ea9b96d7736",
  "hypotheses": {
    "by_type": {
      "cross_sectional": 10,
      "overlay": 10,
      "unknown": 0
    },
    "count": 20,
    "semantic_hashes": [
      "160994ea826a",
      "1a8e5d9be608",
      "21b6815dab19",
      "223c1388dd79",
      "2ad5e59dc7e8",
      "5c3ac3e0ac53",
      "5e1dccdcdc12",
      "6544907b80bc",
      "69f7613d272c",
      "863d9cba03c7",
      "a70fe32ca0c9",
      "a71d7b4caed1",
      "b16150acda09",
      "ca9294f9205f",
      "cc4f378d62ef",
      "e35b7918459f",
      "e4642a927731",
      "e62c605ada13",
      "f6adf5de0a3c",
      "faabc7027d1b"
    ]
  },
  "kind": "crucible_closed_search",
  "power": {
    "decisive_mde_multiple": 1.0,
    "economic_floor": 0.1,
    "economic_floor_gates_hash": "519158fa1450",
    "economic_floor_source": "generation.min_combination_uplift",
    "mde_at_test_max": null,
    "mde_at_test_min": null,
    "mde_source": "none",
    "mde_substrate": null,
    "mde_unmeasured_ticks": 1
  },
  "provenance": {
    "cohort_gates_hashes": [],
    "contracts": [
      "shipped"
    ],
    "corrected_gates_hashes": [],
    "crucible_versions": [
      "crucible-v2.8"
    ],
    "data_snapshot_hashes": [
      "1234a0326bb5",
      "1e64afa768b1",
      "448e4a8ce5ea",
      "747952e9ddb0",
      "acc540972d24"
    ],
    "first_date": "2026-07-05",
    "gates_hashes": [
      "22a18172be1a"
    ],
    "last_date": "2026-07-06",
    "manifest_hashes": [
      "97d165ed8517"
    ],
    "proposers": [
      "library-seed-v1"
    ],
    "runs": 1,
    "search_memory_gates_hashes": [],
    "source": "trial_ledger"
  },
  "rejections": {
    "decisive": 0,
    "unclassified": null,
    "underpowered": 0
  },
  "schema_version": 1,
  "substrate": {
    "data_end": "2026-07-06",
    "data_sources": [
      "FinMind daily bars"
    ],
    "data_start": "2010-01-01",
    "id": "taiwan",
    "search_space": "library seed formulas plus genetic offspring; 21-day hold",
    "universe": "10 Taiwan-listed ETFs (equity, bond, commodity), scored against a TAIEX and sector futures trend book"
  },
  "ticks": {
    "cohort_only": 0,
    "errors": 0,
    "idle": 4,
    "mined": 1,
    "no_score": 0,
    "screened_only": 0,
    "screened_unknown": 1,
    "tested": 0,
    "total": 5,
    "underpowered_skips": 0
  },
  "trials": {
    "holdout_count_complete": false,
    "holdout_tested": null,
    "preregistered": 32,
    "promising": 0,
    "recorded": 52,
    "scored": 20
  },
  "verdict": "OPEN_UNDERPOWERED",
  "verdict_reasons": [
    "holdout_count_not_recorded",
    "power_not_measured"
  ]
}
