{
  "export_id": "338b9611c475",
  "hypotheses": {
    "by_type": {
      "cross_sectional": 44,
      "overlay": 71,
      "unknown": 0
    },
    "count": 115,
    "semantic_hashes": [
      "00b81ecbbc3a",
      "017c21508a3b",
      "02cbdf1911e3",
      "0c9897918319",
      "16a308d11c8a",
      "16c3de559aff",
      "16ea906aeae5",
      "1c39126e9e30",
      "21794c35e0a5",
      "2261368dfaa4",
      "241062531d49",
      "259cbf1b1994",
      "2d463be66e9e",
      "2dd03a604f26",
      "32e8af593a35",
      "3665f3f6a2fc",
      "3b9cc9cfbc15",
      "3edc4636ea8f",
      "4160dc7e0043",
      "427d356158c6",
      "44e66adb4732",
      "4600434bd870",
      "49714c8ededf",
      "49ad7bab19da",
      "49e3036ccd86",
      "4b76c080505b",
      "4be5d9a135df",
      "4e88d43b5db8",
      "5150d1506ee2",
      "523f4d429d6c",
      "5359f9c72a06",
      "542f4477dc1a",
      "546884233706",
      "547e3138f238",
      "5943325f1d01",
      "59dcb0b20316",
      "5bd0935de3a9",
      "5db56143130f",
      "5fefb4af4b17",
      "635ea6b582ce",
      "64d96e3306e7",
      "66282d746c80",
      "694e16bf5371",
      "6989988140f5",
      "715f9664a26a",
      "755faeeaca45",
      "76eae52081be",
      "7ae8dedaeb22",
      "7d568118d6f7",
      "7da614b794bc",
      "7feae4a06e5b",
      "82152b52570a",
      "835ddd67f88c",
      "885dd9248cb8",
      "8b76cc979def",
      "8c841100220b",
      "8d2f288bc16b",
      "8ddb335988cd",
      "8df40ad703ab",
      "8e7a673553bf",
      "8fd3b2e07cad",
      "8fd46f433d4f",
      "9041dadd89e7",
      "94bd1ef4e97b",
      "956f48bae20f",
      "970a116dbf3f",
      "9738e18f766e",
      "97f2716712ce",
      "9935caa92d09",
      "995d6794c65b",
      "9b23abec3025",
      "9bfc18c83c9a",
      "9ccf51ca227a",
      "a0dcda3e51b0",
      "a1ca93d6a5c4",
      "a2cc42098302",
      "a3ad9c1e2198",
      "a438b00a71ea",
      "a5761c9bdebe",
      "a767c61f26a7",
      "a8494bf8f55a",
      "a8ebb9a60238",
      "ab88b59b9d27",
      "adf5cd140a0a",
      "af0549146077",
      "b00c9c292425",
      "b9dd511888aa",
      "ba56110f384e",
      "bbe5182404bb",
      "bc9932f8bb6b",
      "be9808cdfa64",
      "c22e51674873",
      "c78ceace86b7",
      "c9c05d2d48b6",
      "cbdfe62c3216",
      "ccb56287d364",
      "cf60a9b3c4c7",
      "d1f2cbeaf8a2",
      "d21d35aca99e",
      "dbc7b67adf9a",
      "deeabb901832",
      "e0c8802f778a",
      "e40d20ea1bb9",
      "e6c920d4f045",
      "e6f0928de6c3",
      "e73284aec944",
      "e76f42be3148",
      "eb38c7041b94",
      "ec44cacd3ace",
      "ef5749a22b10",
      "f154609b0da7",
      "f42fc0f4fc55",
      "f5575bd18ce0",
      "f765bacafe0a",
      "fb478566dadb"
    ]
  },
  "kind": "crucible_closed_search",
  "power": {
    "decisive_mde_multiple": 1.0,
    "economic_floor": 0.1,
    "economic_floor_gates_hash": "519158fa1450",
    "economic_floor_source": "generation.min_combination_uplift",
    "mde_at_test_max": 1.402505,
    "mde_at_test_min": 1.402505,
    "mde_source": "tick_log",
    "mde_substrate": 1.402505,
    "mde_unmeasured_ticks": 3
  },
  "provenance": {
    "cohort_gates_hashes": [],
    "contracts": [
      "shipped"
    ],
    "corrected_gates_hashes": [],
    "crucible_versions": [
      "crucible-v2.8",
      "crucible-v2.9"
    ],
    "data_snapshot_hashes": [
      "2805b3e42ae2",
      "2eb335da1919",
      "9c6114164fa0",
      "b41be53246db"
    ],
    "first_date": "2026-07-07",
    "gates_hashes": [
      "22a18172be1a"
    ],
    "last_date": "2026-07-12",
    "manifest_hashes": [
      "1aca76e1aac7",
      "6ae176ad3619",
      "7dee0530e8cd",
      "e7826d7deb8c",
      "f9c419de20b4"
    ],
    "proposers": [
      "library-seed-v1",
      "llm-claude-cli-2.1.183-claude-sonnet-4-6-prompt8327c765",
      "llm-claude-cli-local-sonnet-prompt8327c765"
    ],
    "runs": 5,
    "search_memory_gates_hashes": [],
    "source": "trial_ledger"
  },
  "rejections": {
    "decisive": 0,
    "unclassified": null,
    "underpowered": 0
  },
  "schema_version": 1,
  "substrate": {
    "data_end": "2026-07-12",
    "data_sources": [
      "FinMind daily bars"
    ],
    "data_start": "2010-01-01",
    "id": "taiwan",
    "search_space": "library seed formulas and LLM-proposed formulas, plus genetic offspring; 21-day hold",
    "universe": "10 Taiwan-listed ETFs (equity, bond, commodity), scored against a TAIEX and sector futures trend book"
  },
  "ticks": {
    "cohort_only": 0,
    "errors": 0,
    "idle": 3,
    "mined": 5,
    "no_score": 0,
    "screened_only": 0,
    "screened_unknown": 5,
    "tested": 0,
    "total": 11,
    "underpowered_skips": 3
  },
  "trials": {
    "holdout_count_complete": false,
    "holdout_tested": null,
    "preregistered": 151,
    "promising": 0,
    "recorded": 241,
    "scored": 117
  },
  "verdict": "OPEN_UNDERPOWERED",
  "verdict_reasons": [
    "holdout_count_not_recorded",
    "mde_above_floor"
  ]
}
