{
  "export_id": "5f1c75cd5b86",
  "hypotheses": {
    "by_type": {
      "cross_sectional": 110,
      "overlay": 55,
      "unknown": 0
    },
    "count": 165,
    "semantic_hashes": [
      "01d9d0131399",
      "026b5ac62599",
      "0320c2cd95a3",
      "047417073b32",
      "04a543c26391",
      "05353b5e9c58",
      "0676601ac35c",
      "080216d301e1",
      "08a9b2dab089",
      "08b1b2ff7e2f",
      "0984c6eb616e",
      "09dafc384605",
      "146463d2d260",
      "14d79043fcc6",
      "150a31bdd61a",
      "19fae61f5944",
      "1cf653a0f077",
      "1e6bbdc27f4b",
      "2071643b0dca",
      "20dccf2deac6",
      "21dee7aa49ad",
      "22af98b4a2b0",
      "2635952c86d1",
      "2730f25174da",
      "283f9544a411",
      "29f4e6ee8e86",
      "2d7a7f501a4e",
      "2e9b535c0cb7",
      "2fb10bdcb4ef",
      "32cb2e759e38",
      "342f77a90c05",
      "3432074993c6",
      "35d87c1a1436",
      "36baed3d46b5",
      "36e34e5fc640",
      "3946a207c7c9",
      "3aa09a2cb107",
      "3b20e32a365c",
      "3ba9c527b2f8",
      "401eb83f81e2",
      "403bf06b6287",
      "40f96dff45d5",
      "419341d78e8a",
      "4462bf001cdd",
      "44e470fbee55",
      "457dfa5f135f",
      "4734cbba78e9",
      "4787b0bf5e4d",
      "4862eb917c92",
      "48f03678379b",
      "498d5ac6cbae",
      "4affc23aa5e9",
      "4ba61cddeefa",
      "4be41ac2094c",
      "4bfd4a485462",
      "4d024ee2d399",
      "4daf8ef7bd6e",
      "502b39e2e1bb",
      "513c61a9f961",
      "53b12b38e251",
      "5577603041a8",
      "576a0164037d",
      "58555b9f59f7",
      "59990059e203",
      "5b68aadbe74a",
      "5c56e492b3e4",
      "5ec97b4863cd",
      "5ee20d1f9aed",
      "60af05fc8771",
      "60f5c12769fd",
      "61cc243b4202",
      "658fe10ca49c",
      "65b2f9238921",
      "6a7e2063996c",
      "6b42fd63349f",
      "6b8edf335bbe",
      "6c0b2d3eef64",
      "6d103e128e1c",
      "6e60d9e82510",
      "6ffd3fb21383",
      "721cbbefcf32",
      "721f599e1a7a",
      "743beee107fb",
      "7460d7073102",
      "7512f81a8992",
      "756aa44b620d",
      "76737148f6aa",
      "76e48a62cc17",
      "795d18e403e2",
      "7a46cc3d6006",
      "7d9416175f2f",
      "81041f3fabd9",
      "81ca4c7e4de6",
      "82a1cdef491e",
      "8391192daf19",
      "842d4fdafc80",
      "851273d798f8",
      "85aa1c48bb56",
      "85ae8d8d86b8",
      "89351bbd7cf4",
      "8abfd09a9edb",
      "8bc7255ad0f8",
      "91d8e193e55f",
      "9283ee0310e1",
      "94283b6f464f",
      "95d843588c59",
      "97110c90c664",
      "9a7d989bf8d0",
      "9abb132945b2",
      "9bb79c6fe31c",
      "9d13697f82d4",
      "9ddd242aa721",
      "9e7bee59e3d4",
      "a1e757351167",
      "a3b7eb1be22e",
      "a4e81a53bcd5",
      "a53c6bba4918",
      "a61a7f849452",
      "a6a7b6cb6a4b",
      "a885b0ae90d9",
      "abeb14526fe8",
      "ac1edb060fce",
      "ac73f2c2dd97",
      "b02cdd8b73a0",
      "b3004f0a330e",
      "b4f0d20c21db",
      "b9370e9d8332",
      "b96100e335a3",
      "b9d5a5b6afbb",
      "baf782f64d9b",
      "bcbce7d34c0d",
      "bd7e8ff9677f",
      "bdfc4c14f029",
      "c0507cfa72be",
      "c19cf34ae14e",
      "c20b6b5a34ac",
      "c45faf7156c8",
      "c8e008c17c0f",
      "cbffce574f18",
      "d107956882e9",
      "d1c6f70353c2",
      "d5688a2ae3ec",
      "d5b59aa69889",
      "d5b9a4e9c506",
      "d5da4683d898",
      "d8bfd84f5174",
      "dbdf182d9b1c",
      "e05e6a35c5fa",
      "e07beb59a90b",
      "e1bed560a3d7",
      "e1e7d44b89b3",
      "e3f3a31c88a6",
      "e6fcb5b3b004",
      "e85b910e90d3",
      "e910793bebac",
      "ebd6a955142e",
      "f02e44f22722",
      "f03484c4f9b6",
      "f13a938f8568",
      "f483af160c9d",
      "f4d7eb513d4c",
      "f686f4d081ae",
      "fa653096ca52",
      "fdbea441fbe1",
      "ff44805974cf"
    ]
  },
  "kind": "crucible_closed_search",
  "power": {
    "decisive_mde_multiple": 1.0,
    "economic_floor": 0.1,
    "economic_floor_gates_hash": "d1523707b860",
    "economic_floor_source": "guards.uplift_min",
    "mde_at_test_max": null,
    "mde_at_test_min": null,
    "mde_source": "none",
    "mde_substrate": null,
    "mde_unmeasured_ticks": 1
  },
  "provenance": {
    "cohort_gates_hashes": [
      "8da0722fa4dd"
    ],
    "contracts": [
      "corrected"
    ],
    "corrected_gates_hashes": [
      "d1523707b860"
    ],
    "crucible_versions": [
      "crucible-v13.0"
    ],
    "data_snapshot_hashes": [
      "4045a3574b51"
    ],
    "first_date": "2026-08-11",
    "gates_hashes": [
      "d380b7f56bd4"
    ],
    "last_date": "2026-08-11",
    "manifest_hashes": [
      "63b410f0f412"
    ],
    "proposers": [
      "library-seed-v1"
    ],
    "runs": 1,
    "search_memory_gates_hashes": [
      "26a0f6433347"
    ],
    "source": "trial_ledger"
  },
  "rejections": {
    "decisive": 0,
    "unclassified": 98,
    "underpowered": 0
  },
  "schema_version": 1,
  "substrate": {
    "data_end": "2026-08-11",
    "data_sources": [
      "S&P 500 membership history (fja05680)",
      "Yahoo Finance daily bars"
    ],
    "data_start": "2007-01-01",
    "id": "us_equity",
    "search_space": "library seed formulas plus genetic offspring (the library includes the WorldQuant-101 bank); 21-day hold",
    "universe": "S&P 500 members (point-in-time), top 300 by trailing dollar volume each day"
  },
  "ticks": {
    "cohort_only": 0,
    "errors": 0,
    "idle": 0,
    "mined": 1,
    "no_score": 0,
    "screened_only": 0,
    "screened_unknown": 0,
    "tested": 1,
    "total": 1,
    "underpowered_skips": 0
  },
  "trials": {
    "holdout_count_complete": true,
    "holdout_tested": 98,
    "preregistered": 145,
    "promising": 0,
    "recorded": 165,
    "scored": 165
  },
  "verdict": "OPEN_UNDERPOWERED",
  "verdict_reasons": [
    "unclassified_rejections",
    "power_not_measured"
  ]
}
